{
  "totalRecords": 285,
  "meta": {
    "generatedAt": "2024-07-20T11:30:00Z"
  },
  "recurringAbove50": {
    "description": "Main audit types where recurring issues exceed 50% of total issues. Sorted by recurringPercent descending. Top 5 shown out of 4 qualifying audits.",
    "totalQualifyingAudits": 4,
    "top5": [
      {
        "auditName": "Supply Chain Audit",
        "recurringCount": 16,
        "totalIssues": 25,
        "recurringPercent": 64
      },
      {
        "auditName": "Risk Management Audit",
        "recurringCount": 14,
        "totalIssues": 23,
        "recurringPercent": 60.9
      },
      {
        "auditName": "Environmental Compliance Audit",
        "recurringCount": 11,
        "totalIssues": 19,
        "recurringPercent": 57.9
      },
      {
        "auditName": "Data Security Audit",
        "recurringCount": 9,
        "totalIssues": 16,
        "recurringPercent": 56.3
      }
    ]
  },
  "repeatAbove75": {
    "description": "Main audit types where repeat issues exceed 75% of total issues. Sorted by repeatPercent descending. Top 5 shown out of 0 qualifying audits.",
    "totalQualifyingAudits": 0,
    "top5": []
  },
  "highZeroToleranceRisk": {
    "description": "Top 3 main audit types by count of High and Zero Tolerance risk issues, split by recurring and repeat tagging.",
    "byRecurring": {
      "description": "Top 3 audits ranked by count of recurring issues with Risk Level = High or Zero Tolerance.",
      "top3": [
        {
          "auditName": "Risk Management Audit",
          "issueCount": 12
        },
        {
          "auditName": "Supply Chain Audit",
          "issueCount": 10
        },
        {
          "auditName": "IT Infrastructure Audit",
          "issueCount": 8
        }
      ]
    },
    "byRepeat": {
      "description": "Top 3 audits ranked by count of repeat issues with Risk Level = High or Zero Tolerance.",
      "top3": [
        {
          "auditName": "Data Security Audit",
          "issueCount": 11
        },
        {
          "auditName": "Environmental Compliance Audit",
          "issueCount": 9
        },
        {
          "auditName": "Customer Service Audit",
          "issueCount": 7
        }
      ]
    }
  },
  "groupDistribution": {
    "description": "Top 3 groups with highest and bottom 3 groups with lowest recurring and repeat issue counts.",
    "recurring": {
      "description": "Groups ranked by recurring issue count — top 3 highest and bottom 3 lowest.",
      "top3": [
        {
          "groupName": "North Region",
          "recurringCount": 55
        },
        {
          "groupName": "West Region",
          "recurringCount": 48
        },
        {
          "groupName": "South Region",
          "recurringCount": 39
        }
      ],
      "bottom3": [
        {
          "groupName": "East Region",
          "recurringCount": 7
        },
        {
          "groupName": "Central Region",
          "recurringCount": 11
        },
        {
          "groupName": "Northeast Region",
          "recurringCount": 15
        }
      ]
    },
    "repeat": {
      "description": "Groups ranked by repeat issue count — top 3 highest and bottom 3 lowest.",
      "top3": [
        {
          "groupName": "North Region",
          "repeatCount": 45
        },
        {
          "groupName": "West Region",
          "repeatCount": 37
        },
        {
          "groupName": "South Region",
          "repeatCount": 29
        }
      ],
      "bottom3": [
        {
          "groupName": "Northeast Region",
          "repeatCount": 5
        },
        {
          "groupName": "East Region",
          "repeatCount": 9
        },
        {
          "groupName": "Central Region",
          "repeatCount": 13
        }
      ]
    }
  }
}