{
  "totalRecords": 50,
  "meta": {
    "generatedAt": "2024-10-27T12:30:00Z"
  },
  "recurringAbove50": {
    "description": "Main audit types where recurring issues exceed 50% of total issues. Sorted by recurringPercent descending. Top 5 shown out of 1 qualifying audit.",
    "totalQualifyingAudits": 1,
    "top5": [
      {
        "auditName": "Cybersecurity Policy Audit",
        "recurringCount": 15,
        "totalIssues": 20,
        "recurringPercent": 75
      }
    ]
  },
  "repeatAbove75": {
    "description": "Main audit types where repeat issues exceed 75% of total issues. Sorted by repeatPercent descending. Top 5 shown out of 1 qualifying audit.",
    "totalQualifyingAudits": 1,
    "top5": [
      {
        "auditName": "Data Privacy Compliance Audit",
        "repeatCount": 18,
        "totalIssues": 20,
        "repeatPercent": 90
      }
    ]
  },
  "highZeroToleranceRisk": {
    "description": "Top 3 main audit types by count of High and Zero Tolerance risk issues, split by recurring and repeat tagging.",
    "byRecurring": {
      "description": "Top 3 audits ranked by count of recurring issues with Risk Level = High or Zero Tolerance.",
      "top3": [
        {
          "auditName": "Cybersecurity Policy Audit",
          "issueCount": 10
        }
      ]
    },
    "byRepeat": {
      "description": "Top 3 audits ranked by count of repeat issues with Risk Level = High or Zero Tolerance.",
      "top3": [
        {
          "auditName": "Data Privacy Compliance Audit",
          "issueCount": 14
        }
      ]
    }
  },
  "groupDistribution": {
    "description": "Top 3 groups with highest and bottom 3 groups with lowest recurring and repeat issue counts.",
    "recurring": {
      "description": "Groups ranked by recurring issue count — top 3 highest and bottom 3 lowest.",
      "top3": [
        {
          "groupName": "IT Department",
          "recurringCount": 25
        }
      ],
      "bottom3": [
        {
          "groupName": "HR Department",
          "recurringCount": 3
        }
      ]
    },
    "repeat": {
      "description": "Groups ranked by repeat issue count — top 3 highest and bottom 3 lowest.",
      "top3": [
        {
          "groupName": "Legal & Compliance",
          "repeatCount": 20
        }
      ],
      "bottom3": [
        {
          "groupName": "Marketing Department",
          "repeatCount": 2
        }
      ]
    }
  }
}